[
  {
    "entity": "sf_application_case.application_case",
    "owner_component": "CMP-015",
    "isolation_class": "TENANT_SCOPED",
    "rls": "FORCE"
  },
  {
    "entity": "sf_application_case.case_request_reference",
    "owner_component": "CMP-015",
    "isolation_class": "TENANT_SCOPED",
    "rls": "FORCE"
  },
  {
    "entity": "sf_application_case.case_transition",
    "owner_component": "CMP-015",
    "isolation_class": "TENANT_SCOPED",
    "rls": "FORCE"
  },
  {
    "entity": "sf_application_case.idempotency_record",
    "owner_component": "CMP-015",
    "isolation_class": "TENANT_SCOPED",
    "rls": "FORCE"
  },
  {
    "entity": "sf_application_case.outbox_event",
    "owner_component": "CMP-015",
    "isolation_class": "TENANT_SCOPED",
    "rls": "FORCE"
  },
  {
    "entity": "sf_application_case.outbox_event_platform",
    "owner_component": "CMP-015",
    "isolation_class": "PLATFORM_OPERATIONAL",
    "rls": "NOT_APPLICABLE"
  },
  {
    "entity": "sf_application_case.inbox_event",
    "owner_component": "CMP-015",
    "isolation_class": "TENANT_SCOPED",
    "rls": "FORCE"
  },
  {
    "entity": "sf_application_case.inbox_event_platform",
    "owner_component": "CMP-015",
    "isolation_class": "PLATFORM_OPERATIONAL",
    "rls": "NOT_APPLICABLE"
  }
]
