[
  {
    "entity": "sf_ai_gateway.model_registry",
    "owner_component": "CMP-039",
    "isolation_class": "TENANT_SCOPED",
    "rls": "FORCE"
  },
  {
    "entity": "sf_ai_gateway.ai_policy",
    "owner_component": "CMP-039",
    "isolation_class": "TENANT_SCOPED",
    "rls": "FORCE"
  },
  {
    "entity": "sf_ai_gateway.ai_request_metadata",
    "owner_component": "CMP-039",
    "isolation_class": "TENANT_SCOPED",
    "rls": "FORCE"
  },
  {
    "entity": "sf_ai_gateway.idempotency_record",
    "owner_component": "CMP-039",
    "isolation_class": "TENANT_SCOPED",
    "rls": "FORCE"
  },
  {
    "entity": "sf_ai_gateway.outbox_event",
    "owner_component": "CMP-039",
    "isolation_class": "TENANT_SCOPED",
    "rls": "FORCE"
  },
  {
    "entity": "sf_ai_gateway.outbox_event_platform",
    "owner_component": "CMP-039",
    "isolation_class": "PLATFORM_OPERATIONAL",
    "rls": "NOT_APPLICABLE"
  },
  {
    "entity": "sf_ai_gateway.inbox_event",
    "owner_component": "CMP-039",
    "isolation_class": "TENANT_SCOPED",
    "rls": "FORCE"
  },
  {
    "entity": "sf_ai_gateway.inbox_event_platform",
    "owner_component": "CMP-039",
    "isolation_class": "PLATFORM_OPERATIONAL",
    "rls": "NOT_APPLICABLE"
  }
]
