[
  {
    "entity": "sf_evidence.evidence_policy",
    "owner_component": "CMP-011",
    "isolation_class": "TENANT_SCOPED",
    "rls": "FORCE"
  },
  {
    "entity": "sf_evidence.evidence_resolution",
    "owner_component": "CMP-011",
    "isolation_class": "TENANT_SCOPED",
    "rls": "FORCE"
  },
  {
    "entity": "sf_evidence.idempotency_record",
    "owner_component": "CMP-011",
    "isolation_class": "TENANT_SCOPED",
    "rls": "FORCE"
  },
  {
    "entity": "sf_evidence.outbox_event",
    "owner_component": "CMP-011",
    "isolation_class": "TENANT_SCOPED",
    "rls": "FORCE"
  },
  {
    "entity": "sf_evidence.outbox_event_platform",
    "owner_component": "CMP-011",
    "isolation_class": "PLATFORM_OPERATIONAL",
    "rls": "NOT_APPLICABLE"
  },
  {
    "entity": "sf_evidence.inbox_event",
    "owner_component": "CMP-011",
    "isolation_class": "TENANT_SCOPED",
    "rls": "FORCE"
  },
  {
    "entity": "sf_evidence.inbox_event_platform",
    "owner_component": "CMP-011",
    "isolation_class": "PLATFORM_OPERATIONAL",
    "rls": "NOT_APPLICABLE"
  }
]
